{
  "schema_registry": [
    {
      "id": "action-contract.schema",
      "file": "machine/schemas/action-contract.schema.json",
      "schema_type": "machine_catalog_schema",
      "parent_contract": "machine/action_contracts.json",
      "owner": "core.modules",
      "status": "canonical",
      "used_by": [
        "machine/action_contracts.json"
      ],
      "validates": "machine/action_contracts.json",
      "human_document": "docs/03-functional/07-action-contracts.md",
      "last_reviewed": "2026-05-31",
      "doctor_check_id": "SCHEMA_REGISTRY_COVERS_MACHINE_SCHEMAS"
    },
    {
      "id": "ai-action-log.schema",
      "file": "machine/schemas/ai-action-log.schema.json",
      "schema_type": "machine_catalog_schema",
      "parent_contract": null,
      "owner": "core.doctor",
      "status": "support",
      "used_by": [],
      "validates": null,
      "human_document": "docs/09-ai-operations/07-machine-readable-docs.md",
      "last_reviewed": "2026-05-31",
      "doctor_check_id": "SCHEMA_REGISTRY_COVERS_MACHINE_SCHEMAS"
    },
    {
      "id": "ai-approval-policy.schema",
      "file": "machine/schemas/ai-approval-policy.schema.json",
      "schema_type": "machine_catalog_schema",
      "parent_contract": "machine/ai_approval_policy.json",
      "owner": "ai_assistant",
      "status": "canonical",
      "used_by": [
        "machine/ai_approval_policy.json"
      ],
      "validates": "machine/ai_approval_policy.json",
      "human_document": "docs/09-ai-operations/00-ai-operating-model.md",
      "last_reviewed": "2026-05-31",
      "doctor_check_id": "SCHEMA_REGISTRY_COVERS_MACHINE_SCHEMAS"
    },
    {
      "id": "ai-runbook.schema",
      "file": "machine/schemas/ai-runbook.schema.json",
      "schema_type": "machine_catalog_schema",
      "parent_contract": "machine/ai_runbooks.json",
      "owner": "ai_assistant",
      "status": "canonical",
      "used_by": [
        "machine/ai_runbooks.json"
      ],
      "validates": "machine/ai_runbooks.json",
      "human_document": "docs/09-ai-operations/04-ai-runbooks.md",
      "last_reviewed": "2026-06-01",
      "doctor_check_id": "AI_RUNBOOKS_SCHEMA_VALID"
    },
    {
      "id": "ai-behavior-fixture.schema",
      "file": "machine/schemas/ai-behavior-fixture.schema.json",
      "schema_type": "machine_catalog_schema",
      "parent_contract": "machine/ai_behavior_fixtures.json",
      "owner": "ai_assistant",
      "status": "canonical",
      "used_by": [
        "machine/ai_behavior_fixtures.json"
      ],
      "validates": "machine/ai_behavior_fixtures.json",
      "human_document": "docs/09-ai-operations/09-ai-behavior-fixtures.md",
      "last_reviewed": "2026-05-31",
      "doctor_check_id": "SCHEMA_REGISTRY_COVERS_MACHINE_SCHEMAS"
    },
    {
      "id": "ai-context-trust-policy.schema",
      "file": "machine/schemas/ai-context-trust-policy.schema.json",
      "schema_type": "machine_catalog_schema",
      "parent_contract": "machine/ai_context_trust_policy.json",
      "owner": "ai_assistant",
      "status": "canonical",
      "used_by": [
        "machine/ai_context_trust_policy.json"
      ],
      "validates": "machine/ai_context_trust_policy.json",
      "human_document": "docs/09-ai-operations/03-ai-guardrails.md",
      "last_reviewed": "2026-05-31",
      "doctor_check_id": "SCHEMA_REGISTRY_COVERS_MACHINE_SCHEMAS"
    },
    {
      "id": "api-error.schema",
      "file": "machine/schemas/api-error.schema.json",
      "schema_type": "machine_catalog_schema",
      "parent_contract": null,
      "owner": "core.doctor",
      "status": "support",
      "used_by": [],
      "validates": null,
      "human_document": "docs/09-ai-operations/07-machine-readable-docs.md",
      "last_reviewed": "2026-05-31",
      "doctor_check_id": "SCHEMA_REGISTRY_COVERS_MACHINE_SCHEMAS"
    },
    {
      "id": "api-response.schema",
      "file": "machine/schemas/api-response.schema.json",
      "schema_type": "machine_catalog_schema",
      "parent_contract": null,
      "owner": "core.doctor",
      "status": "support",
      "used_by": [],
      "validates": null,
      "human_document": "docs/09-ai-operations/07-machine-readable-docs.md",
      "last_reviewed": "2026-05-31",
      "doctor_check_id": "SCHEMA_REGISTRY_COVERS_MACHINE_SCHEMAS"
    },
    {
      "id": "approval-record.schema",
      "file": "machine/schemas/approval-record.schema.json",
      "schema_type": "machine_catalog_schema",
      "parent_contract": null,
      "owner": "core.doctor",
      "status": "support",
      "used_by": [],
      "validates": null,
      "human_document": "docs/09-ai-operations/07-machine-readable-docs.md",
      "last_reviewed": "2026-05-31",
      "doctor_check_id": "SCHEMA_REGISTRY_COVERS_MACHINE_SCHEMAS"
    },
    {
      "id": "backlog-item.schema",
      "file": "machine/schemas/backlog-item.schema.json",
      "schema_type": "machine_catalog_schema",
      "parent_contract": "machine/backlog_items.json",
      "owner": "core.doctor",
      "status": "canonical",
      "used_by": [
        "machine/backlog_items.json"
      ],
      "validates": "machine/backlog_items.json",
      "human_document": "docs/11-backlog/00-backlog-overview.md",
      "last_reviewed": "2026-05-31",
      "doctor_check_id": "SCHEMA_REGISTRY_COVERS_MACHINE_SCHEMAS"
    },
    {
      "id": "column-contract.schema",
      "file": "machine/schemas/column-contract.schema.json",
      "schema_type": "machine_catalog_schema",
      "parent_contract": "machine/column_contracts.json",
      "owner": "core.data",
      "status": "canonical",
      "used_by": [
        "machine/column_contracts.json"
      ],
      "validates": "machine/column_contracts.json",
      "human_document": "docs/05-domain-data/01-entities.md",
      "last_reviewed": "2026-05-31",
      "doctor_check_id": "SCHEMA_REGISTRY_COVERS_MACHINE_SCHEMAS"
    },
    {
      "id": "critical-decision.schema",
      "file": "machine/schemas/critical-decision.schema.json",
      "schema_type": "machine_catalog_schema",
      "parent_contract": "machine/critical_decisions.json",
      "owner": "core.doctor",
      "status": "canonical",
      "used_by": [
        "machine/critical_decisions.json"
      ],
      "validates": "machine/critical_decisions.json",
      "human_document": "docs/12-decisions/01-critical-decisions.md",
      "last_reviewed": "2026-05-31",
      "doctor_check_id": "SCHEMA_REGISTRY_COVERS_MACHINE_SCHEMAS"
    },
    {
      "id": "decision-dependency-matrix.schema",
      "file": "machine/schemas/decision-dependency-matrix.schema.json",
      "schema_type": "machine_catalog_schema",
      "parent_contract": "machine/decision_dependency_matrix.json",
      "owner": "core.events",
      "status": "canonical",
      "used_by": [
        "machine/decision_dependency_matrix.json"
      ],
      "validates": "machine/decision_dependency_matrix.json",
      "human_document": "docs/12-decisions/01-critical-decisions.md",
      "last_reviewed": "2026-05-31",
      "doctor_check_id": "SCHEMA_REGISTRY_COVERS_MACHINE_SCHEMAS"
    },
    {
      "id": "decision-id-map.schema",
      "file": "machine/schemas/decision-id-map.schema.json",
      "schema_type": "machine_catalog_schema",
      "parent_contract": "machine/decision_id_map.json",
      "owner": "core.events",
      "status": "canonical",
      "used_by": [
        "machine/decision_id_map.json"
      ],
      "validates": "machine/decision_id_map.json",
      "human_document": "docs/12-decisions/06-decision-id-map.md",
      "last_reviewed": "2026-05-31",
      "doctor_check_id": "SCHEMA_REGISTRY_COVERS_MACHINE_SCHEMAS"
    },
    {
      "id": "decision.schema",
      "file": "machine/schemas/decision.schema.json",
      "schema_type": "machine_catalog_schema",
      "parent_contract": "machine/decisions.json",
      "owner": "core.events",
      "status": "canonical",
      "used_by": [
        "machine/decisions.json"
      ],
      "validates": "machine/decisions.json",
      "human_document": "docs/12-decisions/00-decision-log.md",
      "last_reviewed": "2026-05-31",
      "doctor_check_id": "SCHEMA_REGISTRY_COVERS_MACHINE_SCHEMAS"
    },
    {
      "id": "design-token.schema",
      "file": "machine/schemas/design-token.schema.json",
      "schema_type": "machine_catalog_schema",
      "parent_contract": "machine/design_tokens.json",
      "owner": "design.ux",
      "status": "canonical",
      "used_by": [
        "machine/design_tokens.json"
      ],
      "validates": "machine/design_tokens.json",
      "human_document": "docs/07-design-ux/10-design-tokens.md",
      "last_reviewed": "2026-05-31",
      "doctor_check_id": "SCHEMA_REGISTRY_COVERS_MACHINE_SCHEMAS"
    },
    {
      "id": "doctor-check.schema",
      "file": "machine/schemas/doctor-check.schema.json",
      "schema_type": "machine_catalog_schema",
      "parent_contract": "machine/doctor_checks.json",
      "owner": "core.doctor",
      "status": "canonical",
      "used_by": [
        "machine/doctor_checks.json"
      ],
      "validates": "machine/doctor_checks.json",
      "human_document": "docs/13-quality/06-doctor-checks.md",
      "last_reviewed": "2026-05-31",
      "doctor_check_id": "SCHEMA_REGISTRY_COVERS_MACHINE_SCHEMAS"
    },
    {
      "id": "domain-constraints-enforcement-matrix.schema",
      "file": "machine/schemas/domain-constraints-enforcement-matrix.schema.json",
      "schema_type": "machine_catalog_schema",
      "parent_contract": "machine/domain_constraints_enforcement_matrix.json",
      "owner": "core.data",
      "status": "canonical",
      "used_by": [
        "machine/domain_constraints_enforcement_matrix.json"
      ],
      "validates": "machine/domain_constraints_enforcement_matrix.json",
      "human_document": "docs/05-domain-data/04-data-strategy.md",
      "last_reviewed": "2026-05-31",
      "doctor_check_id": "SCHEMA_REGISTRY_COVERS_MACHINE_SCHEMAS"
    },
    {
      "id": "domain-event-envelope.schema",